{"backend":{"engine_kind":"elk","module_sha256":"b0745abd7f23cd91690a1587e377edbe19fd7233c783300290936720546216d4","node_version":"22.22.3","package_name":"elkjs","package_sha256":"fb9bb80b980c72022fb4540b38aa0545242b4eb67b82250aeae2f0beb67eea25","package_version":"0.9.3","renderer_sha256":"cccccccccccccccccccccccccccccccccccccccccccccccccccccccccccccccc"},"layers":["containers","edges","nodes","labels"],"locale":"en","primitives":[{"children":["a","b"],"evidence_ids":["file:bbbbbbbbbbbbbbbbbbbbbbbbbbbbbbbbbbbbbbbbbbbbbbbbbbbbbbbbbbbbbbbb"],"height":240,"id":"runtime","kind":"group","layer":"containers","source_id":"runtime","width":540,"x":40,"y":40,"z":0},{"evidence_ids":["file:eeeeeeeeeeeeeeeeeeeeeeeeeeeeeeeeeeeeeeeeeeeeeeeeeeeeeeeeeeeeeeee"],"id":"edge-line","kind":"line","layer":"edges","source_id":"edge-line","x1":240,"x2":360,"y1":130,"y2":130,"z":1},{"evidence_ids":["file:ffffffffffffffffffffffffffffffffffffffffffffffffffffffffffffffff"],"id":"edge-path","kind":"path","layer":"edges","points":[{"x":360,"y":130},{"x":300,"y":320},{"x":240,"y":130}],"source_id":"edge-path","z":1},{"evidence_ids":["file:cccccccccccccccccccccccccccccccccccccccccccccccccccccccccccccccc"],"height":60,"id":"a","kind":"rect","layer":"nodes","source_id":"a","width":160,"x":80,"y":100,"z":2},{"evidence_ids":["file:dddddddddddddddddddddddddddddddddddddddddddddddddddddddddddddddd"],"height":60,"id":"b","kind":"rect","layer":"nodes","source_id":"b","width":160,"x":360,"y":100,"z":2},{"evidence_ids":["file:aaaaaaaaaaaaaaaaaaaaaaaaaaaaaaaaaaaaaaaaaaaaaaaaaaaaaaaaaaaaaaaa"],"font_size":16,"id":"text:__scene_intent__","kind":"text","layer":"labels","lines":["Flow diagram"],"role":"title","source_id":"__scene_intent__","text":"Flow diagram","widths":[96],"x":0,"y":20,"z":3},{"evidence_ids":["file:cccccccccccccccccccccccccccccccccccccccccccccccccccccccccccccccc"],"font_size":16,"id":"text:a","kind":"text","layer":"labels","lines":["Request"],"role":"node","source_id":"a","text":"Request","widths":[64],"x":88,"y":132,"z":3},{"evidence_ids":["file:dddddddddddddddddddddddddddddddddddddddddddddddddddddddddddddddd"],"font_size":16,"id":"text:b","kind":"text","layer":"labels","lines":["Storage"],"role":"node","source_id":"b","text":"Storage","widths":[64],"x":368,"y":132,"z":3},{"evidence_ids":["file:eeeeeeeeeeeeeeeeeeeeeeeeeeeeeeeeeeeeeeeeeeeeeeeeeeeeeeeeeeeeeeee"],"font_size":16,"id":"text:edge-line","kind":"text","layer":"labels","lines":["Call"],"role":"edge","source_id":"edge-line","text":"Call","widths":[32],"x":300,"y":130,"z":3},{"evidence_ids":["file:ffffffffffffffffffffffffffffffffffffffffffffffffffffffffffffffff"],"font_size":16,"id":"text:edge-path","kind":"text","layer":"labels","lines":["Return"],"role":"edge","source_id":"edge-path","text":"Return","widths":[48],"x":300,"y":320,"z":3},{"evidence_ids":["file:bbbbbbbbbbbbbbbbbbbbbbbbbbbbbbbbbbbbbbbbbbbbbbbbbbbbbbbbbbbbbbbb"],"font_size":16,"id":"text:runtime","kind":"text","layer":"labels","lines":["Runtime"],"role":"group","source_id":"runtime","text":"Runtime","widths":[56],"x":48,"y":64,"z":3}],"schema_version":1,"source_spec_sha256":"1111111111111111111111111111111111111111111111111111111111111111","theme_sha256":"2222222222222222222222222222222222222222222222222222222222222222","variant":"desktop","view_box":{"height":400,"width":1200,"x":0,"y":0}}
